{
  "$schema": "https://json-schema.org/draft/2020-12/schema",
  "$id": "https://apimigrate.dev/schemas/manifest.schema.json",
  "title": "API Migration Manifest",
  "description": "Machine-readable description of an API change and how to migrate code that uses it. The core asset of the apimigrate product: a vendor ships these, or apimigrate curates them, and customers' codebases are scanned against them.",
  "type": "object",
  "required": ["schemaVersion", "id", "vendor", "title", "severity", "lang", "changedAt", "changes"],
  "properties": {
    "schemaVersion": { "const": "1.0", "description": "Version of the manifest format itself." },
    "id": {
      "type": "string",
      "description": "Unique ID, e.g. 'stripe-2025-05-01-amount-decimal'."
    },
    "vendor": { "type": "string", "description": "Vendor slug, e.g. 'stripe'." },
    "title": { "type": "string", "description": "Human-readable change title, e.g. 'Amount fields migrated from integer cents to decimal dollars'." },
    "severity": {
      "enum": ["breaking", "deprecation", "feature"],
      "description": "Impact class. 'breaking' means the old usage stops working; 'deprecation' means it warns but still works; 'feature' is additive."
    },
    "lang": { "type": "string", "description": "Primary target language, e.g. 'typescript'." },
    "changedAt": {
      "type": "string",
      "format": "date",
      "description": "Date the change takes effect, ISO 8601."
    },
    "references": {
      "type": "array",
      "items": { "type": "string", "format": "uri" },
      "description": "Links to the vendor changelog or migration guide."
    },
    "changes": {
      "type": "array",
      "minItems": 1,
      "items": {
        "type": "object",
        "required": ["type", "description"],
        "properties": {
          "type": {
            "enum": ["renamed-call", "removed-parameter", "renamed-parameter", "changed-parameter-type", "renamed-field", "removed-field", "renamed-enum-value", "sdk-upgrade", "deprecated-call"],
            "description": "Kind of change. The scanner engine treats these as queryable patterns."
          },
          "description": { "type": "string", "description": "What changed, for humans and for the PR description." },
          "match": {
            "type": "object",
            "properties": {
              "call": {
                "type": "object",
                "properties": {
                  "name": { "type": "string", "description": "Function or method name to match, e.g. 'stripe.charges.create' (dotted) or 'createCharge'." },
                  "object": { "type": "string", "description": "Optional receiver object name for method calls, e.g. 'stripe'." }
                },
                "required": ["name"],
                "description": "Match usages of a call."
              },
              "field": {
                "type": "object",
                "properties": {
                  "name": { "type": "string", "description": "Field or property name, e.g. 'amount'." },
                  "object": { "type": "string", "description": "Optional containing object/type name." }
                },
                "required": ["name"],
                "description": "Match object property access or construction."
              },
              "parameter": {
                "type": "object",
                "properties": {
                  "name": { "type": "string", "description": "Parameter name to match, e.g. 'sku'." }
                },
                "required": ["name"],
                "description": "Match a call site passing this parameter."
              },
              "sdk": {
                "type": "object",
                "properties": {
                  "package": { "type": "string", "description": "Package name to match, e.g. 'stripe'." },
                  "minVersion": { "type": "string", "description": "Minimum required version; matches imports below this." }
                },
                "description": "Match SDK import/version constraints."
              }
            },
            "description": "At least one match pattern; the scanner returns a hit when a pattern matches."
          },
          "fix": {
            "type": "object",
            "description": "Optional mechanical fix to apply. If absent, the change is report-only.",
            "properties": {
              "kind": {
                "enum": ["rename-call", "rename-field", "rename-parameter", "remove-parameter", "rename-enum-value", "convert-amount", "replace"],
                "description": "Kind of codemod."
              },
              "from": { "type": "string", "description": "Old name (for rename kinds)." },
              "to": { "type": "string", "description": "New name." },
              "value": { "type": "string", "description": "Literal value for replace/enum kinds." },
              "explain": { "type": "string", "description": "Human explanation of the fix, used in the PR body." }
            }
          }
        }
      }
    }
  }
}
